{
  "schema": "agent-memory-production-beta-integrity-input-v1",
  "classification": "production_external",
  "environment": "production",
  "review_id": "beta-integrity-2026-08",
  "anomaly_engine_version": "rules-v1",
  "audit_chain_verifier_version": "chain-v1",
  "archive_reconciler_version": "archive-v1",
  "signal_classification_version": "classification-v1",
  "residual_risk_policy_version": "risk-v1",
  "inventory_id": "production-inventory",
  "inventory_receipt_sha256": "aaaaaaaaaaaaaaaaaaaaaaaaaaaaaaaaaaaaaaaaaaaaaaaaaaaaaaaaaaaaaaaa",
  "plan_id": "production-plan",
  "plan_receipt_sha256": "bbbbbbbbbbbbbbbbbbbbbbbbbbbbbbbbbbbbbbbbbbbbbbbbbbbbbbbbbbbbbbbb",
  "change_id": "production-change",
  "change_receipt_sha256": "cccccccccccccccccccccccccccccccccccccccccccccccccccccccccccccccc",
  "release_id": "production-release",
  "release_receipt_sha256": "dddddddddddddddddddddddddddddddddddddddddddddddddddddddddddddddd",
  "beta_slo_observation_id": "beta-slo-2026-08",
  "beta_slo_receipt_sha256": "eeeeeeeeeeeeeeeeeeeeeeeeeeeeeeeeeeeeeeeeeeeeeeeeeeeeeeeeeeeeeeee",
  "beta_operations_assessment_id": "beta-operations-2026-08",
  "beta_operations_receipt_sha256": "ffffffffffffffffffffffffffffffffffffffffffffffffffffffffffffffff",
  "window_start": "2026-08-11T00:00:00Z",
  "window_end": "2026-08-12T00:00:00Z",
  "audit_database_chain_report_sha256": "1111111111111111111111111111111111111111111111111111111111111111",
  "audit_archive_reconciliation_sha256": "2222222222222222222222222222222222222222222222222222222222222222",
  "isolation_signal_export_sha256": "3333333333333333333333333333333333333333333333333333333333333333",
  "audit_integrity_signal_export_sha256": "4444444444444444444444444444444444444444444444444444444444444444",
  "anomaly_report_sha256": "5555555555555555555555555555555555555555555555555555555555555555",
  "residual_risk_decision_sha256": "6666666666666666666666666666666666666666666666666666666666666666",
  "security_review_sha256": "7777777777777777777777777777777777777777777777777777777777777777",
  "risk_policy_approved_at": "2026-08-10T06:00:00Z",
  "snapshot_at": "2026-08-12T01:00:00Z",
  "reviewed_at": "2026-08-12T20:00:00Z",
  "generated_at": "2026-08-12T21:00:00Z",
  "audit_event_count": 1000,
  "chain_verified_event_count": 1000,
  "chain_break_count": 0,
  "archive_expected_count": 1000,
  "archive_verified_count": 1000,
  "archive_missing_count": 0,
  "archive_checksum_mismatch_count": 0,
  "isolation_signal_count": 3,
  "isolation_explained_signal_count": 3,
  "isolation_unexplained_signal_count": 0,
  "isolation_unclassified_signal_count": 0,
  "audit_integrity_signal_count": 2,
  "audit_integrity_explained_signal_count": 2,
  "audit_integrity_unexplained_signal_count": 0,
  "audit_integrity_unclassified_signal_count": 0,
  "anomaly_finding_count": 5,
  "closed_anomaly_finding_count": 5,
  "open_anomaly_finding_count": 0,
  "ready": true,
  "checks": [
    {"id": "shared_window_exports_complete", "outcome": "passed", "evidence_sha256": "1111111111111111111111111111111111111111111111111111111111111111"},
    {"id": "audit_chain_verification_complete", "outcome": "passed", "evidence_sha256": "2222222222222222222222222222222222222222222222222222222222222222"},
    {"id": "audit_archive_reconciliation_complete", "outcome": "passed", "evidence_sha256": "3333333333333333333333333333333333333333333333333333333333333333"},
    {"id": "isolation_signals_classified", "outcome": "passed", "evidence_sha256": "4444444444444444444444444444444444444444444444444444444444444444"},
    {"id": "audit_integrity_signals_classified", "outcome": "passed", "evidence_sha256": "5555555555555555555555555555555555555555555555555555555555555555"},
    {"id": "anomaly_report_closed", "outcome": "passed", "evidence_sha256": "6666666666666666666666666666666666666666666666666666666666666666"},
    {"id": "no_unexplained_isolation_signal", "outcome": "passed", "evidence_sha256": "7777777777777777777777777777777777777777777777777777777777777777"},
    {"id": "no_unexplained_audit_integrity_signal", "outcome": "passed", "evidence_sha256": "8888888888888888888888888888888888888888888888888888888888888888"},
    {"id": "security_residual_risk_review_complete", "outcome": "passed", "evidence_sha256": "9999999999999999999999999999999999999999999999999999999999999999"}
  ]
}
